{
  "$schema": "https://json-schema.org/draft/2020-12/schema",
  "$id": "https://media-monitor/contracts/news_digest_group.v1.json",
  "title": "news_digest_group.v1",
  "description": "Experimental structured digest grouping contract aligned with stage03 digest_jsonls.",
  "type": "object",
  "additionalProperties": false,
  "properties": {
    "schema_name": {
      "const": "news_digest_group.v1"
    },
    "schema_status": {
      "const": "experimental_structured"
    },
    "digest_group_id": {
      "type": "string",
      "minLength": 1
    },
    "digest_id_hour": {
      "type": "string",
      "pattern": "^[0-9]{8}T[0-9]{2}$"
    },
    "window_type": {
      "type": "string",
      "enum": [
        "A",
        "B",
        "C",
        "D",
        "E",
        "F",
        "1h_window",
        "recent_4h_window",
        "recent_window",
        "4h_window",
        "8h_window",
        "2day_window",
        "3day_window",
        "weekly_window",
        "fortnight_window"
      ],
      "description": "Producer-native digest window category. Legacy A..F values remain accepted for backward compatibility; recent_4h_window is the default rolling horizon and recent_window is the generic configured rolling horizon for low-cadence outlets."
    },
    "topic": {
      "type": "string",
      "minLength": 1
    },
    "group_number": {
      "type": "integer",
      "minimum": 1
    },
    "content": {
      "type": "array",
      "items": {
        "type": "object",
        "additionalProperties": false,
        "properties": {
          "article_id": {
            "type": "string",
            "minLength": 1
          },
          "title": {
            "type": "string",
            "minLength": 1
          },
          "source": {
            "type": "string",
            "minLength": 1
          },
          "link": {
            "type": "string",
            "format": "uri"
          },
          "published": {
            "type": "string",
            "format": "date-time"
          }
        },
        "required": [
          "article_id",
          "title",
          "source",
          "link",
          "published"
        ]
      }
    }
  },
  "required": [
    "schema_name",
    "schema_status",
    "digest_group_id",
    "digest_id_hour",
    "window_type",
    "topic",
    "group_number",
    "content"
  ]
}
